{
  "dataset_id": "imrag-mock-root-cause-starter",
  "version": "0.1.0",
  "description": "Starter evaluation dataset for the five numbered mock scenarios. Ground truth is derived from the scenario builders in src/scenarios/__init__.py and the deterministic mock root-cause path in app.py.",
  "cases": [
    {
      "test_id": "mock_s1_root_cause_001",
      "scenario_id": "scenario_1_vm_destroy",
      "user_query": "What is the main reason for the CI Team cost spike in Scenario 1?",
      "expected_root_cause_label": "failed_cleanup_orphaned_resources",
      "expected_team": "ci-team",
      "expected_service": "load-test environment",
      "reference_answer": "The CI Team spike is caused by failed cleanup of the load-test environment. deploy-loadtest created the environment, then destroy-loadtest failed on January 10, 11, and 12, 2025 because terraform-destroy hit a state-lock error, leaving the load-test VMs running.",
      "expected_tool_trajectory": [
        "pipeline_tool",
        "cost_api_tool"
      ],
      "notes": "Derived from app.py _build_mock_root_cause_result for scenario_1_vm_destroy and scenario builder resources res-loadtest-1 / res-loadtest-2."
    },
    {
      "test_id": "mock_s2_root_cause_001",
      "scenario_id": "scenario_2_tagging",
      "user_query": "What is the main root cause of the unallocated cost increase in Scenario 2?",
      "expected_root_cause_label": "tagging_regression_misattribution",
      "expected_team": "release-team",
      "expected_service": "resource-tagging",
      "reference_answer": "The increase is caused by a tagging regression rather than real new usage. deploy-release-prod on January 14, 2025 introduced incorrect tags, including team=legacy and missing ownership tags, so Release Team spend was pushed into the unallocated bucket.",
      "expected_tool_trajectory": [
        "pipeline_tool",
        "cost_api_tool"
      ],
      "notes": "expected_service is modeled as a service-like control-plane category because this scenario is a cost-allocation issue, not a single runtime workload."
    },
    {
      "test_id": "mock_s3_root_cause_001",
      "scenario_id": "scenario_3_autoscaler",
      "user_query": "What is the main reason for the Release Team cost spike in Scenario 3?",
      "expected_root_cause_label": "autoscaler_no_scale_down",
      "expected_team": "release-team",
      "expected_service": "web-frontend-asg",
      "reference_answer": "The spike is caused by a bad autoscaler configuration change. update-web-autoscaler ran on January 9, 2025, then web-frontend-asg scaled from 4 to 12 instances on January 10 and never scaled back down, creating sustained compute cost.",
      "expected_tool_trajectory": [
        "pipeline_tool",
        "cost_api_tool"
      ],
      "notes": "Ground truth comes from app.py scenario 3 root-cause summary and the scenario resource metrics for res-web-frontend / web-frontend-asg."
    },
    {
      "test_id": "mock_s4_root_cause_001",
      "scenario_id": "scenario_4_forgotten_poc",
      "user_query": "What is the main reason for the CloudOps Team cost spike in Scenario 4?",
      "expected_root_cause_label": "forgotten_poc_environment",
      "expected_team": "cloudops-team",
      "expected_service": "poc-analytics",
      "reference_answer": "The spike is caused by a forgotten proof-of-concept environment. deploy-poc-analytics created analytics resources that stayed active after January 14, 2025, while the dashboard POC was cleaned up successfully. The abandoned analytics environment is the cost driver.",
      "expected_tool_trajectory": [
        "pipeline_tool",
        "cost_api_tool"
      ],
      "notes": "Derived from app.py scenario 4 root-cause answer and scenario resources poc-analytics-vm-1 and poc-analytics-db."
    },
    {
      "test_id": "mock_s5_root_cause_001",
      "scenario_id": "scenario_5_app_misconfig",
      "user_query": "What is the main reason for the Release Team cost spike in Scenario 5?",
      "expected_root_cause_label": "application_misconfiguration_over_scaling",
      "expected_team": "release-team",
      "expected_service": "release-api",
      "reference_answer": "The spike is caused by an application configuration mistake in deploy-release-api. The January 19, 2025 rollout set MAX_WORKERS=500, which triggered a pod surge and retry storm in the release-api workload, driving excess compute usage.",
      "expected_tool_trajectory": [
        "pipeline_tool",
        "cost_api_tool"
      ],
      "notes": "Ground truth is based on app.py scenario 5 root-cause logic and the scenario resource rel-api-pods / release-api metrics."
    }
  ]
}
